root@ubuntu-s-1vcpu-1gb-nyc1-01:~# tcpdump -n icmp

18:39:51.034456 IP 192.168.1.254 > 192.168.1.11: ICMP net 185.199.108.154 unreachable, length 60
18:39:51.035890 IP 192.168.1.254 > 192.168.1.11: ICMP net 185.199.108.154 unreachable, length 60
18:39:53.076651 IP 192.168.1.254 > 192.168.1.11: ICMP net 185.31.76.91 unreachable, length 60
18:39:53.077722 IP 192.168.1.254 > 192.168.1.11: ICMP net 198.252.206.25 unreachable, length 60
18:39:55.124386 IP 192.168.1.254 > 192.168.1.11: ICMP net 104.25.57.103 unreachable, length 48
18:39:57.172864 IP 192.168.1.254 > 192.168.1.11: ICMP net 151.101.65.69 unreachable, length 60
18:39:57.174032 IP 192.168.1.254 > 192.168.1.11: ICMP net 104.26.9.211 unreachable, length 48
18:39:57.203737 IP 192.168.1.254 > 192.168.1.11: ICMP net 152.199.43.87 unreachable, length 48
18:39:59.220579 IP 192.168.1.254 > 192.168.1.11: ICMP net 216.239.32.116 unreachable, length 60
18:40:01.269977 IP 192.168.1.254 > 192.168.1.11: ICMP net 199.232.20.116 unreachable, length 60
18:40:01.371837 IP 192.168.1.254 > 192.168.1.11: ICMP net 104.18.40.210 unreachable, length 48
18:40:01.467776 IP 192.168.1.254 > 192.168.1.11: ICMP net 104.42.39.77 unreachable, length 60
18:40:05.396732 IP 192.168.1.254 > 192.168.1.11: ICMP net 104.244.42.129 unreachable, length 60
18:40:05.447827 IP 192.168.1.254 > 192.168.1.11: ICMP net 104.244.42.136 unreachable, length 60
18:40:07.413026 IP 192.168.1.254 > 192.168.1.11: ICMP net 104.16.28.34 unreachable, length 48
18:40:07.414042 IP 192.168.1.254 > 192.168.1.11: ICMP net 104.16.152.14 unreachable, length 48
^C
16 packets captured
16 packets received by filter
0 packets dropped by kernel

root@ubuntu-s-1vcpu-1gb-nyc1-01:~# tcpdump -n not icmp

18:42:02.098637 IP 192.168.1.11.54692 > 18.211.35.165.443: Flags [.], ack 1583202524, win 501, options [nop,nop,TS val 629310652 ecr 103860267], length 0
18:42:04.174634 IP 192.168.1.11.39346 > 74.125.200.188.5228: Flags [.], ack 944128309, win 501, options [nop,nop,TS val 2328514163 ecr 1441203980], length 0
18:42:04.256612 IP 74.125.200.188.5228 > 192.168.1.11.39346: Flags [.], ack 1, win 259, options [nop,nop,TS val 1441249064 ecr 2328422609], length 0
18:42:04.716827 IP 192.168.1.11.48971 > 172.217.166.238.443: UDP, length 23
18:42:04.770976 IP 172.217.166.238.443 > 192.168.1.11.48971: UDP, length 20
18:42:12.082634 IP 192.168.1.11.59410 > 140.82.114.25.443: Flags [.], ack 2811578964, win 501, options [nop,nop,TS val 704093981 ecr 3718473763], length 0
18:42:12.439031 IP 140.82.114.25.443 > 192.168.1.11.59410: Flags [.], ack 1, win 31, options [nop,nop,TS val 3718485107 ecr 704048563], length 0
18:42:12.690637 IP 192.168.1.11.39264 > 198.252.206.25.443: Flags [.], ack 2975479612, win 501, options [nop,nop,TS val 950148026 ecr 3633129293], length 0
18:42:13.051068 IP 198.252.206.25.443 > 192.168.1.11.39264: Flags [.], ack 1, win 62, options [nop,nop,TS val 3633174685 ecr 950057360], length 0
^C
9 packets captured
9 packets received by filter
0 packets dropped by kernel


root@ubuntu-s-1vcpu-1gb-nyc1-01:~# tcpdump -n'icmp[icmptype] != icmp-echo and icmp[icmptype] !=icmp-echoreply'**

Not giving output
